<?xml version="1.0"?>
<!--
To change this license header, choose License Headers in Project Properties.
To change this template file, choose Tools | Templates
and open the template in the editor.
-->

<xs:schema version="1.0"
           xmlns:xs="http://www.w3.org/2001/XMLSchema"
           targetNamespace="http://www.centralregiondonate.noodles.com"
           xmlns="http://www.centralregiondonate.noodles.com"
           elementFormDefault="qualified">
    <xs:element name="noodles" type="Noodles"/>
    <xs:complexType name="Noodles">
        <xs:sequence>
            <xs:element name="noodle" type="Noodle" maxOccurs="unbounded"/>
        </xs:sequence>
    </xs:complexType>
    <xs:complexType name="Noodle">
        <xs:sequence>
            <xs:element name="noodleName" type="xs:string"/>
            <xs:element name="price" type="xs:decimal"/>
        </xs:sequence>
    </xs:complexType>
</xs:schema>
